{
  "schema_version": "aicx.quiz_prompt.v0",
  "quiz_prompt_id": "PROMPT-QUIZ-ASB-2026-06-22",
  "quiz_set_id": "QUIZ-ASB-2026-06-22",
  "generated_for_date": "2026-06-22",
  "timezone": "Asia/Tokyo",
  "delivery_time": "04:30",
  "source_quiz_set_path": "artifacts/runs/poc-2f-aicx-study-bot-10q-live/quiz_set.json",
  "answer_key_included": false,
  "rationale_included": false,
  "answer_format": "multiple_choice_a_d",
  "study_window": {
    "week_id": "WEEK-ASB-2026-06-17",
    "date_from": "2026-06-17",
    "date_to": "2026-06-23",
    "study_pages": [
      {
        "from": 258,
        "to": 368
      }
    ],
    "focus_topics": [
      "条件分岐",
      "コンテキストエンジニアリング",
      "組織設計",
      "KPI",
      "チェック"
    ]
  },
  "study_range_label": "p.258-368",
  "question_count": 10,
  "questions": [
    {
      "question_number": 1,
      "question_id": "QB-ASB-BRANCHING-001",
      "topic_id": "TOPIC-BRANCHING-CONTEXT",
      "topic_label": "条件分岐 / コンテキストエンジニアリング",
      "page_ranges": [
        {
          "from": 258,
          "to": 288
        }
      ],
      "prompt": "問い合わせ対応エージェントで、入力内容によって処理を変えたい。If/Else、ルーティング、フィルタリングの違いとして最も適切な説明はどれですか。",
      "choices": [
        {
          "choice": "A",
          "text": "If/Else は条件で処理を分け、ルーティングは担当経路へ振り分け、フィルタリングは対象外を除外する"
        },
        {
          "choice": "B",
          "text": "If/Else、ルーティング、フィルタリングはいずれも同じ意味で、呼び方だけが違う"
        },
        {
          "choice": "C",
          "text": "ルーティングは必ずLLMで判断し、If/Elseは使ってはいけない"
        },
        {
          "choice": "D",
          "text": "フィルタリングは回答品質を上げるため、全入力を通過させる設計を指す"
        }
      ]
    },
    {
      "question_number": 2,
      "question_id": "QB-ASB-BRANCHING-002",
      "topic_id": "TOPIC-BRANCHING-CONTEXT",
      "topic_label": "条件分岐 / コンテキストエンジニアリング",
      "page_ranges": [
        {
          "from": 258,
          "to": 288
        }
      ],
      "prompt": "条件分岐が増えすぎて、現場がどの経路に進むか説明できなくなっています。次に取る設計判断として最も適切なものはどれですか。",
      "choices": [
        {
          "choice": "A",
          "text": "分岐をすべてプロンプトに押し込み、例外は運用で吸収する"
        },
        {
          "choice": "B",
          "text": "分岐条件、優先順位、例外時の戻し先を表で管理し、テストケースで確認する"
        },
        {
          "choice": "C",
          "text": "判断不能なケースも必ず自動実行し、人間確認はなくす"
        },
        {
          "choice": "D",
          "text": "分岐が複雑なほど高機能なので、整理せずに追加し続ける"
        }
      ]
    },
    {
      "question_number": 3,
      "question_id": "QB-ASB-WORKFLOW-001",
      "topic_id": "TOPIC-WORKFLOW-CHECK",
      "topic_label": "チェック / ワークフロー検証",
      "page_ranges": [
        {
          "from": 289,
          "to": 311
        }
      ],
      "prompt": "AIワークフローのPoCで、通常ケースは成功していますが例外入力の扱いが未確認です。次に優先すべき確認はどれですか。",
      "choices": [
        {
          "choice": "A",
          "text": "通常ケースが動いたので、例外入力の確認は本番後に回す"
        },
        {
          "choice": "B",
          "text": "例外入力、判断不能、権限不足のケースを用意し、停止・人間確認・再実行の経路を確認する"
        },
        {
          "choice": "C",
          "text": "例外はすべてLLMに自由記述で解釈させ、ログは残さない"
        },
        {
          "choice": "D",
          "text": "例外入力が起きたら利用者に再入力させるだけで十分とする"
        }
      ]
    },
    {
      "question_number": 4,
      "question_id": "QB-ASB-WORKFLOW-002",
      "topic_id": "TOPIC-WORKFLOW-CHECK",
      "topic_label": "チェック / ワークフロー検証",
      "page_ranges": [
        {
          "from": 289,
          "to": 311
        }
      ],
      "prompt": "エージェントが複数の外部ツールを呼び出す設計です。監査と改善のためにPoC段階から残すべき情報として最も適切なものはどれですか。",
      "choices": [
        {
          "choice": "A",
          "text": "最終回答だけを保存し、途中判断は保存しない"
        },
        {
          "choice": "B",
          "text": "ツール呼び出し回数だけを保存すれば十分で、入力条件は不要"
        },
        {
          "choice": "C",
          "text": "入力条件、分岐理由、ツール呼び出し、結果、失敗時の処理を追跡できる形で残す"
        },
        {
          "choice": "D",
          "text": "ログはコストになるため、PoCでは一切残さない"
        }
      ]
    },
    {
      "question_number": 5,
      "question_id": "QB-ASB-ORG-KPI-001",
      "topic_id": "TOPIC-ORG-KPI",
      "topic_label": "組織設計 / KPI",
      "page_ranges": [
        {
          "from": 312,
          "to": 327
        }
      ],
      "prompt": "AIエージェント導入のKPIを「利用回数」だけで測ろうとしています。この設計の危険性として最も適切なものはどれですか。",
      "choices": [
        {
          "choice": "A",
          "text": "利用回数は多いほど必ず業務価値が高いため、他の指標は不要になる"
        },
        {
          "choice": "B",
          "text": "利用回数だけでは、時間削減、品質改善、手戻り減少、現場負荷の変化が見えない"
        },
        {
          "choice": "C",
          "text": "利用回数は一切測ってはいけないため、KPIから除外するべきである"
        },
        {
          "choice": "D",
          "text": "KPIは導入後に自然に決まるので、PoC前には考えない"
        }
      ]
    },
    {
      "question_number": 6,
      "question_id": "QB-ASB-ORG-KPI-002",
      "topic_id": "TOPIC-ORG-KPI",
      "topic_label": "組織設計 / KPI",
      "page_ranges": [
        {
          "from": 312,
          "to": 327
        }
      ],
      "prompt": "現場から「AIに仕事を奪われそうで使いたくない」という抵抗が出ています。導入判断として最も適切なものはどれですか。",
      "choices": [
        {
          "choice": "A",
          "text": "抵抗は無視し、利用を義務化して短期間で定着させる"
        },
        {
          "choice": "B",
          "text": "現場の不安、役割分担、責任範囲を確認し、支援対象と人間判断が残る範囲を明確にする"
        },
        {
          "choice": "C",
          "text": "抵抗がある場合は、業務価値があってもAI導入を必ず中止する"
        },
        {
          "choice": "D",
          "text": "説明資料だけを配布し、業務フローや評価制度は変えない"
        }
      ]
    },
    {
      "question_number": 7,
      "question_id": "QB-ASB-GOVERNANCE-001",
      "topic_id": "TOPIC-ADOPTION-GOVERNANCE",
      "topic_label": "導入設計 / 運用統制",
      "page_ranges": [
        {
          "from": 328,
          "to": 350
        }
      ],
      "prompt": "AIエージェントの回答を誰が最終確認するかが曖昧です。運用設計として最も適切なものはどれですか。",
      "choices": [
        {
          "choice": "A",
          "text": "AIが出した回答は常に正しいものとして扱い、確認者は置かない"
        },
        {
          "choice": "B",
          "text": "重要度やリスクに応じて、AI自動処理、人間確認、責任者承認の境界を定める"
        },
        {
          "choice": "C",
          "text": "確認者は毎回その場で決め、記録は残さない"
        },
        {
          "choice": "D",
          "text": "責任範囲はPoCでは扱わず、本番障害が出てから決める"
        }
      ]
    },
    {
      "question_number": 8,
      "question_id": "QB-ASB-GOVERNANCE-002",
      "topic_id": "TOPIC-ADOPTION-GOVERNANCE",
      "topic_label": "導入設計 / 運用統制",
      "page_ranges": [
        {
          "from": 328,
          "to": 350
        }
      ],
      "prompt": "現場からプロンプトや分岐条件の変更要望が頻繁に出ています。運用統制として最も適切なものはどれですか。",
      "choices": [
        {
          "choice": "A",
          "text": "誰でも本番プロンプトを直接編集できるようにする"
        },
        {
          "choice": "B",
          "text": "変更理由、影響範囲、テスト結果、承認者を残してから反映する"
        },
        {
          "choice": "C",
          "text": "変更管理は速度を落とすので、履歴は残さない"
        },
        {
          "choice": "D",
          "text": "変更要望はすべて却下し、初期設計を固定する"
        }
      ]
    },
    {
      "question_number": 9,
      "question_id": "QB-ASB-5D-001",
      "topic_id": "TOPIC-5D",
      "topic_label": "5D前半 / Discovery・Definition",
      "page_ranges": [
        {
          "from": 351,
          "to": 368
        }
      ],
      "prompt": "5Dの流れで、Discovery と Definition の違いとして最も適切なものはどれですか。",
      "choices": [
        {
          "choice": "A",
          "text": "Discovery は課題や現状を探索し、Definition は解くべき問題と成功条件を定義する"
        },
        {
          "choice": "B",
          "text": "Discovery は本番実装で、Definition はリリース後の振り返りである"
        },
        {
          "choice": "C",
          "text": "Discovery と Definition は同じ作業で、順序を分ける必要はない"
        },
        {
          "choice": "D",
          "text": "Definition では成功条件を決めず、ツール選定だけを行う"
        }
      ]
    },
    {
      "question_number": 10,
      "question_id": "QB-ASB-5D-002",
      "topic_id": "TOPIC-5D",
      "topic_label": "5D前半 / Discovery・Definition",
      "page_ranges": [
        {
          "from": 351,
          "to": 368
        }
      ],
      "prompt": "PoCを始める前に固めるべき成功条件として最も適切なものはどれですか。",
      "choices": [
        {
          "choice": "A",
          "text": "使うAIツール名だけを決めれば、成功条件はPoC中に自然に決まる"
        },
        {
          "choice": "B",
          "text": "業務上の改善指標、許容リスク、比較対象、判断タイミングを決めておく"
        },
        {
          "choice": "C",
          "text": "成功条件は高ければ高いほどよいので、測定不能でも問題ない"
        },
        {
          "choice": "D",
          "text": "PoCの目的は動くものを見せることだけなので、KPIは不要である"
        }
      ]
    }
  ]
}
